SID,WORD,POS,Context
352,input,n.,The manager asked for everyone's input on the project.
353,insert,v.,Insert your card into the machine to begin the transaction.
354,inspector,n.,The health inspector visited the restaurant for a routine check.
355,installation,n.,The installation of the software takes about an hour.
356,instant,adj.,He felt an instant attraction to the place.
357,instantly,adv.,The room went silent instantly when the director entered.
358,integrate,v.,They are working to integrate the new members into the team.
359,intellectual,adj.,The debate was intellectual and challenged everyone's thinking.
360,interact,v.,Children need to interact with others to develop social skills.
361,interaction,n.,There was a lot of positive interaction between the team members.
362,interpretation,n.,His interpretation of the events differs from hers.
363,interval,n.,The concerts will be held at regular intervals throughout the summer.
364,invade,v.,"The insects invaded the kitchen, much to the homeowner's dismay."
365,invasion,n.,The invasion of privacy is a serious concern in the digital age.
366,investor,n.,The startup is seeking investors to fund its expansion.
367,isolate,v.,The scientists isolate the virus to study it more thoroughly.
368,isolated,adj.,The farmhouse is located in an isolated part of the countryside.
369,jail,n.,The suspect was held in jail until the court hearing.
370,jet,n.,A private jet took them directly to their destination.
371,joint,adj.,They made a joint decision to sell the house.
372,joint,n.,The knee joint is often injured during sports.
373,journalism,n.,She is studying journalism at the university.
374,jury,n.,The jury found the defendant guilty of the charges.
375,kit,n.,The science kit includes everything you need to perform the experiment.
376,ladder,n.,He climbed the ladder to reach the books on the top shelf.
377,landing,n.,The airplane made a smooth landing at the airport.
378,lane,n.,The new lane on the highway should help reduce traffic.
379,lately,adv.,"Lately, he has been feeling a bit under the weather."
380,leaflet,n.,They handed out leaflets about the upcoming community event.
381,legend,n.,The old legend says the castle is haunted.
382,lens,n.,The photographer switched to a wider lens for the landscape shots.
383,lifetime,n.,He was given a lifetime achievement award for his work in film.
384,lighting,n.,"The lighting in the room was dim, making it hard to read."
385,likewise,adv.,"She voted against the proposal, and her colleagues did likewise."
386,limitation,n.,The study has several limitations that should be considered.
387,literally,adv.,He was literally the last person I expected to see at the party.
388,literary,adj.,The literary festival will feature several well-known authors.
389,litre,n.,The car consumes only five litres of fuel per 100 kilometers.
390,litter,n.,Please do not drop litter in the park.
391,logo,n.,The company's logo is recognized all over the world.
392,lottery,n.,He won a significant amount of money in the lottery.
393,loyal,adj.,She has been a loyal customer of the shop for many years.
394,lyric,n.,The song's lyrics speak about love and loss.
395,magnificent,adj.,The view from the top of the mountain is magnificent.
396,make-up,n.,She applied her make-up meticulously before the interview.
397,making,n.,The making of the documentary took over two years.
398,manufacture,v.,The company manufactures medical equipment.
399,manufacturing,n.,The town's economy is largely based on manufacturing.
400,marathon,n.,He is training for his first marathon next month.
401,margin,n.,The book was filled with notes written in the margins.
402,marker,n.,Please use a marker to highlight the important points.
403,martial,adj.,Martial arts require discipline and physical fitness.
404,mate,n.,My chess mate is very competitive.
405,mate,v.,"In spring, many birds mate and build nests."
406,mayor,n.,The mayor will give a speech at the parade.
407,mechanic,n.,The mechanic fixed the problem with the car engine.
408,mechanical,adj.,He has a talent for fixing mechanical devices.
409,mechanism,n.,The mechanism of the clock is intricate and fascinating.
410,medal,n.,She won a medal in the swimming competition.
411,medication,n.,The doctor prescribed medication for her condition.
412,membership,n.,His gym membership includes access to all facilities.
413,memorable,adj.,It was a memorable day that they would never forget.
414,metaphor,n.,Her poetry uses metaphor to convey complex emotions.
415,miner,n.,The coal miner worked long hours underground.
416,miserable,adj.,The bad weather made them feel miserable.
417,mode,n.,The device can be switched to silent mode.
418,modest,adj.,He lives a modest lifestyle despite his wealth.
419,monster,n.,Children's stories often feature a friendly monster.
420,monthly,adj.,The report provides a monthly update on the project's progress.
421,monument,n.,The monument commemorates those who lost their lives in the war.
422,moreover,adv.,"Moreover, the study shows that the benefits far outweigh the costs."
423,mortgage,n.,They are paying off their mortgage over 25 years.
424,mosque,n.,The mosque is a place of worship for Muslims.
425,motion,n.,The motion of the waves can be hypnotic.
426,motivate,v.,Teachers try to motivate their students to achieve their best.
427,motivation,n.,Lack of motivation can hinder progress in any activity.
428,moving,adj.,The film was deeply moving and brought many to tears.
429,myth,n.,The myth of Atlantis has intrigued people for centuries.
430,naked,adj.,The naked eye can see thousands of stars on a clear night.
431,nasty,adj.,He received a nasty cut from the broken glass.
432,navigation,n.,The ship's navigation system malfunctioned during the storm.
433,nearby,adj.,There's a cafe nearby where we can get coffee.
434,nearby,adv.,"The park is nearby, just a few minutes' walk from here."
435,necessity,n.,Fresh water is a basic necessity for survival.
436,negotiate,v.,The leaders met to negotiate a peace treaty.
437,negotiation,n.,Negotiation is a key skill in business and diplomacy.
438,neutral,adj.,The room is painted in neutral colors to appeal to all buyers.
439,newly,adv.,The newly opened restaurant has become very popular.
440,norm,n.,It's the norm to wear formal attire at the opera.
441,notebook,n.,She took detailed notes in her notebook during the lecture.
442,novelist,n.,The novelist won an award for her latest book.
443,nowadays,adv.,"Nowadays, people rely heavily on their smartphones."
444,nursing,adj.,He is studying for a degree in nursing at the university.
445,nutrition,n.,Good nutrition is vital for maintaining health.
446,obesity,n.,Obesity is a growing problem in many countries.
447,observer,n.,An observer was appointed to ensure the fairness of the election.
448,obstacle,n.,Lack of funding is a major obstacle to the project's success.
449,occupation,n.,His occupation as a journalist takes him all over the world.
450,occupy,v.,The tenants occupy the apartment on a yearly lease.
451,offender,n.,The offender was arrested and charged with theft.
452,ongoing,adj.,The ongoing discussions are expected to lead to a resolution soon.
453,openly,adv.,He spoke openly about his struggles and successes.
454,opera,n.,They attended an opera at the famous Sydney Opera House.
455,operator,n.,The operator of the facility is responsible for its maintenance.
456,optimistic,adj.,"Despite the challenges, he remains optimistic about the future."
457,orchestra,n.,The orchestra performed a selection of classical music.
458,organic,adj.,Many consumers prefer organic products because they are pesticide-free.
459,outfit,n.,She chose an elegant outfit for the evening gala.
460,output,n.,The factory's output has increased by 20% this year.
461,outstanding,adj.,His outstanding performance earned him the leading role.
462,overcome,v.,She had to overcome many difficulties to achieve her goals.
463,overnight,adv.,The small town became famous overnight.
464,overseas,adv.,He decided to move overseas to pursue his career.
465,overseas,adj.,The company is looking to expand its overseas operations.
466,ownership,n.,The ownership of the land is disputed.
467,oxygen,n.,Oxygen is essential for breathing and combustion.
468,packet,n.,The packet contains all the information you need for the assembly.
469,palm,n.,He held the tiny bird gently in his palm.
470,panic,n.,"During the emergency, it was important not to panic."
471,parade,n.,"The parade featured floats, bands, and dancers."
472,parallel,adj.,His career followed a path parallel to hers.
473,parallel,n.,The river runs in parallel with the border for several miles.
474,participation,n.,Employee participation in the decision-making process is encouraged.
475,partnership,n.,The firm entered into a partnership with an overseas company.
476,part-time,adj.,She works part-time while studying for her degree.
477,part-time,adv.,He is employed part-time at the local bookstore.
478,passionate,adj.,She is passionate about wildlife conservation.
479,password,n.,You will need your password to access the account.
480,patience,n.,Patience is required when learning a new skill.
481,pause,v.,Let's pause here and continue after the break.
482,pause,n.,There was a brief pause in the conversation.
483,peer,n.,He respected the opinions of his peers.
484,penalty,n.,The penalty for late submission is a reduction in marks.
485,perceive,v.,She could perceive a change in his attitude.
486,perception,n.,Public perception of the issue has evolved over time.
487,permanently,adv.,The museum collection was permanently displayed for the public.
488,pill,n.,She took a pill to relieve her headache.
489,pity,n.,It's a pity you couldn't join us last night.
490,placement,n.,His placement with the engineering firm will last six months.
491,portion,n.,A portion of the proceeds will go to charity.
492,potentially,adv.,"Potentially, the new drug could save thousands of lives."
493,precede,v.,The introduction will precede the main part of the book.
494,precious,adj.,The precious gemstone was the centerpiece of the exhibit.
495,precise,adj.,The scientist made precise measurements during the experiment.
496,precisely,adv.,He arrived precisely at noon.
497,predictable,adj.,"His behavior was predictable, always following the same pattern."
498,preference,n.,My preference is for classical music over rock.
499,pride,n.,He took great pride in his work.
500,primarily,adv.,The fund is used primarily for educational purposes.
501,principal,adj.,The principal reason for his success is his dedication.
502,prior,adj.,Prior approval is required for any changes to the design.
503,probability,n.,The probability of rain tomorrow is high.
504,probable,adj.,It is probable that the meeting will be postponed.
505,proceed,v.,Please proceed to the next step in the instructions.
506,programming,n.,She is learning programming to enhance her job skills.
507,progressive,adj.,The company is known for its progressive employment policies.
508,prohibit,v.,Smoking is prohibited in all public buildings.
509,promising,adj.,The young athlete has a promising future in professional sports.
510,promotion,n.,She received a promotion after successfully leading the project.
511,prompt,v.,The teacher's question prompted a lively discussion among the students.
512,proportion,n.,A large proportion of the budget was allocated to research.
513,protein,n.,Chicken and fish are excellent sources of protein for muscle growth.
514,protester,n.,The police arrested a protester who refused to leave the demonstration site.
515,psychological,adj.,Stress can have serious psychological effects on a person's well-being.
516,publicity,n.,The new product launch received a lot of publicity in the media.
517,publishing,n.,She has worked in the publishing industry for over a decade.
518,punk,n.,He was a fan of punk music and often attended underground concerts.
519,purely,adv.,Her decision was purely based on logic rather than emotions.
520,pursuit,n.,He left his job in pursuit of his dream to become a filmmaker.
521,puzzle,n.,She enjoys solving crossword puzzles in her free time.
522,questionnaire,n.,All participants were asked to complete a questionnaire about their experiences.
523,racial,adj.,The government introduced policies to address racial discrimination.
524,racism,n.,The organization fights against racism and promotes equality for all.
525,racist,n.,He was labeled a racist after his controversial statements about immigration.
526,radiation,n.,Excessive exposure to radiation can be harmful to human health.
527,rail,n.,The country is investing in an advanced rail system for faster transportation.
528,random,adj.,The lottery numbers were drawn in a completely random order.
529,rat,n.,They saw a rat running across the kitchen floor and called pest control.
530,rating,n.,The movie received a high rating from critics and audiences alike.
531,reasonably,adv.,The hotel was reasonably priced considering its great location.
532,rebuild,v.,"After the earthquake, the city had to rebuild many of its homes and roads."
533,receiver,n.,He picked up the phone receiver and answered the call.
534,recession,n.,The country is struggling with high unemployment due to the economic recession.
535,reckon,v.,I reckon it will take us about two hours to get to the destination.
536,recognition,n.,Her hard work and dedication finally earned her the recognition she deserved.
537,recovery,n.,His recovery after the surgery was faster than expected.
538,recruit,v.,The company plans to recruit more employees next year.
539,recruit,n.,The new recruit quickly adapted to the company's work culture.
540,recruitment,n.,The recruitment process has been designed to be fair and transparent.
541,referee,n.,The referee made a controversial decision during the match.
542,refugee,n.,Thousands of refugees fled their country due to the ongoing war.
543,registration,n.,Registration for the new semester begins next Monday.
544,regulate,v.,The government introduced new laws to regulate online transactions.
545,reinforce,v.,The teacher used real-life examples to reinforce the lesson.
546,relieve,v.,The painkiller helped relieve her headache within minutes.
547,relieved,adj.,She was relieved to hear that her family was safe after the storm.
548,remarkable,adj.,He made a remarkable recovery after the accident.
549,remarkably,adv.,She performed remarkably well in her final exams.
550,reporting,n.,His job in journalism involves investigative reporting.
551,resign,v.,She decided to resign from her position due to personal reasons.
552,resolution,n.,The two parties reached a peaceful resolution after long negotiations.
553,restore,v.,The government plans to restore the historical building to its original state.
554,restrict,v.,They decided to restrict access to sensitive information.
555,restriction,n.,There are travel restrictions due to the ongoing pandemic.
556,retail,n.,Many small businesses in the retail sector struggled during the pandemic.
557,retirement,n.,He is looking forward to his retirement after working for 40 years.
558,revenue,n.,The company's annual revenue has increased by 20%.
559,revision,n.,He spent the weekend doing revision for his final exams.
560,ridiculous,adj.,The idea of flying cars seemed ridiculous a few decades ago.
561,risky,adj.,Investing in cryptocurrency can be quite risky.
562,rival,n.,Their biggest rival in the competition was a team from another country.
563,rival,adj.,Two rival companies are competing to release the latest smartphone technology.
564,rob,v.,The thieves planned to rob the bank at midnight.
565,robbery,n.,The police arrested three suspects involved in the robbery.
566,rocket,n.,The space agency successfully launched a rocket to Mars.
567,romance,n.,The novel is about a forbidden romance between two young lovers.
568,rose,n.,She received a beautiful red rose on Valentine's Day.
569,roughly,adv.,The journey took roughly three hours by car.
570,ruin,v.,The heavy rain ruined our outdoor picnic.
571,ruin,n.,They explored the ancient ruins of a lost civilization.
572,satisfaction,n.,She felt great satisfaction after completing the marathon.
573,scandal,n.,The political scandal caused public outrage.
574,scare,v.,The loud noise scared the children in the park.
575,scare,n.,There was a health scare due to contaminated water in the area.
576,scenario,n.,"In the worst-case scenario, the project might be delayed for months."
577,scholar,n.,The historian is a respected scholar in medieval studies.
578,scholarship,n.,She received a full scholarship to study at a prestigious university.
579,scratch,v.,The cat scratched the furniture with its sharp claws.
580,scratch,n.,He got a small scratch on his arm while hiking.
581,screening,n.,The airport security screening process took longer than expected.
582,seeker,n.,Job seekers should update their resumes frequently.
583,seminar,n.,She attended a seminar on digital marketing strategies.
584,settler,n.,The first settlers in the region built homes near the river.
585,severely,adv.,The storm severely damaged homes along the coast.
586,sexy,adj.,She wore a stylish and sexy dress to the party.
587,shaped,adj.,The cookies were shaped like stars and hearts.
588,shocking,adj.,The news of the accident was shocking to everyone.
589,shore,n.,"They walked along the shore, collecting seashells."
590,shortage,n.,There is a shortage of affordable housing in the city.
591,shortly,adv.,The train will be arriving shortly at platform three.
592,short-term,adj.,This is just a short-term solution; we need a long-term plan.
593,sibling,n.,"She has one sibling, an older brother."
594,signature,n.,Please provide your signature at the bottom of the form.
595,significance,n.,The discovery of the new species has great scientific significance.
596,skilled,adj.,He is a highly skilled surgeon with years of experience.
597,skull,n.,Archaeologists found an ancient human skull in the cave.
598,slogan,n.,"The company's slogan is ""Quality You Can Trust."""
599,so-called,adj.,The so-called expert failed to answer basic questions.
600,somehow,adv.,"Somehow, she managed to finish the project on time."
601,sometime,adv.,Let's meet for coffee sometime next week.
602,sophisticated,adj.,The software uses a sophisticated algorithm to analyze data.
603,spare,adj.,She always carries a spare key in her bag.
604,specialize,v.,"Many doctors specialize in a specific field of medicine, like cardiology or neurology."
605,specify,v.,Please specify your dietary preferences when booking the meal.
606,spectacular,adj.,The fireworks display was absolutely spectacular.
607,spectator,n.,Thousands of spectators attended the championship match.
608,speculate,v.,Analysts speculate that the economy will improve next year.
609,speculation,n.,There is a lot of speculation about who will win the election.
610,spice,n.,This dish has a unique blend of spices for extra flavor.
611,spill,v.,He accidentally spilled coffee on his laptop.
612,spite,n.,"In spite of the bad weather, they continued their journey."
613,spoil,v.,The food spoiled because it was left outside in the heat.
614,spokesman,n.,The company’s spokesman issued a statement about the incident.
615,spokesperson,n.,A spokesperson for the government addressed the media.
616,spokeswoman,n.,The company’s spokeswoman announced the launch of a new product.
617,sponsorship,n.,The sports team secured sponsorship from a major brand.
618,sporting,adj.,The sporting event attracted thousands of spectators.
619,stall,n.,She bought fresh fruit from a market stall.
620,stance,n.,The politician took a firm stance on climate change.
621,starve,v.,"Without food, the animals would starve within days."
622,steadily,adv.,Her health has been improving steadily over the past month.
623,steam,n.,Steam rose from the cup of hot tea.
624,stimulate,v.,Caffeine can stimulate brain activity and improve alertness.
625,strengthen,v.,Regular exercise helps strengthen muscles and bones.
626,strictly,adv.,Smoking is strictly prohibited in this area.
627,stroke,n.,He suffered a stroke and had to be hospitalized.
628,stunning,adj.,The sunset over the mountains was absolutely stunning.
629,subsequent,adj.,The subsequent investigation revealed more details about the case.
630,subsequently,adv.,He was arrested and subsequently charged with theft.
631,suburb,n.,They moved to a quiet suburb outside the city.
632,suffering,n.,The war caused immense suffering for the local people.
633,sufficient,adj.,We need sufficient funds to complete the project successfully.
634,sufficiently,adv.,The instructions were sufficiently clear for everyone to follow.
635,super,adj.,She was super excited about her upcoming vacation.
636,surgeon,n.,The surgeon performed a complex operation successfully.
637,survival,n.,Fresh water is essential for human survival in extreme conditions.
638,survivor,n.,Only a few survivors were found after the earthquake.
639,suspend,v.,The school decided to suspend the student for breaking the rules.
640,sustainable,adj.,Sustainable farming practices help protect the environment.
641,swallow,v.,He took a sip of water to help him swallow the pill.
642,sympathetic,adj.,She was very sympathetic and listened to my problems with concern.
643,tackle,v.,The team worked together to tackle the difficult project.
644,tag,n.,The price tag on the jacket showed a 50% discount.
645,tag,v.,She tagged her friend in a social media post.
646,tap,v.,He tapped the screen to unlock his phone.
647,tap,n.,She turned on the tap to fill the glass with water.
648,technological,adj.,Technological advancements have transformed the way we communicate.
649,teens,n.,A group of teens gathered at the park to play basketball.
650,temple,n.,They visited an ancient temple during their trip to Japan.
651,temporarily,adv.,The shop is temporarily closed for renovations.
652,tendency,n.,She has a tendency to talk quickly when she’s nervous.
653,tension,n.,There was a lot of tension in the room before the exam results were announced.
654,terminal,n.,We waited at the airport terminal for our flight to board.
655,terms,n.,They agreed to the terms of the contract before signing.
656,terribly,adv.,She felt terribly guilty for forgetting her friend's birthday.
657,terrify,v.,The horror movie terrified the audience.
658,territory,n.,Wild animals are very protective of their territory.
659,terror,n.,She screamed in terror when she saw the spider.
660,terrorism,n.,The government is taking strict measures to combat terrorism.
661,terrorist,n.,The authorities arrested a suspected terrorist near the border.
662,testing,n.,The new software is still in the testing phase before its release.
663,textbook,n.,She bought a new biology textbook for the semester.
664,theft,n.,He was arrested for theft after stealing a car.
665,therapist,n.,The therapist helped her manage her anxiety.
666,thesis,n.,He spent months writing his thesis for his master’s degree.
667,thorough,adj.,The detective conducted a thorough investigation of the case.
668,thoroughly,adv.,She cleaned the house thoroughly before the guests arrived.
669,thumb,n.,He accidentally cut his thumb while chopping vegetables.
670,timing,n.,The timing of the meeting was perfect for everyone’s schedule.
671,tissue,n.,She used a tissue to wipe her tears.
672,ton,n.,"The cargo ship can carry up to 50,000 tons of merchandise."
673,tonne,n.,They exported several tonnes of grain last year.
674,tournament,n.,He won first place in the chess tournament.
675,trace,v.,The police traced the call back to its origin.
676,trading,n.,The company specializes in international trading of goods.
677,tragedy,n.,The fire was a terrible tragedy that left many homeless.
678,tragic,adj.,It was a tragic accident that claimed several lives.
679,trait,n.,Honesty is an important trait in a good leader.
680,transmit,v.,The virus can be transmitted through close contact.
681,transportation,n.,Effective transportation systems are crucial for urban development.
682,trap,v.,They got trapped in the elevator when the power went out.
683,trap,n.,The hunters set a trap to catch the wild animal.
684,treasure,n.,The pirates searched for hidden treasure on the island.
685,tribe,n.,The tribe has preserved its unique traditions for centuries.
686,trigger,v.,Her allergy can be triggered by dust and pollen.
687,trillion,num.,The national debt has reached several trillion dollars.
688,troop,n.,The troop of soldiers marched through the city streets.
689,tsunami,n.,The tsunami caused massive destruction along the coastline.
690,ultimate,adj.,His ultimate goal is to become a world champion.
691,unacceptable,adj.,Her rude behavior was completely unacceptable at the meeting.
692,uncertainty,n.,There is a lot of uncertainty about the future of the economy.
693,undergo,v.,She had to undergo surgery after the accident.
694,undertake,v.,The company will undertake a new project to develop renewable energy.
695,unfold,v.,The mystery slowly unfolded as the story progressed.
696,unfortunate,adj.,It was unfortunate that the event had to be canceled due to rain.
697,unite,v.,The two countries decided to unite against a common threat.
698,unity,n.,The team played with great unity and cooperation.
699,universal,adj.,The desire for happiness is a universal human trait.
700,urgent,adj.,He received an urgent call from the hospital.
701,usage,n.,The correct usage of punctuation is important in writing.
702,useless,adj.,The remote control was useless because the batteries were dead.
703,valid,adj.,His passport is valid for another five years.
