SID,WORD,POS,Context
704,variation,n.,There is a lot of variation in temperatures between summer and winter.
705,vertical,adj.,They climbed a steep vertical rock wall during their hike.
706,viewpoint,n.,Everyone in the discussion had a different viewpoint on the issue.
707,visa,n.,He applied for a tourist visa to visit the United States.
708,visible,adj.,The moon was clearly visible in the night sky.
709,voluntary,adj.,She does voluntary work at the local animal shelter.
710,voting,n.,Voting is an important right in a democratic society.
711,wander,v.,She likes to wander through the forest on quiet mornings.
712,warming,n.,Global warming is a major environmental concern.
713,weekly,adj.,She attends a weekly yoga class at the gym.
714,weird,adj.,He had a weird feeling that someone was watching him.
715,welfare,n.,The government provides welfare programs to support low-income families.
716,wheat,n.,Wheat is one of the most widely grown crops in the world.
717,whoever,pron.,Whoever arrives first will get the best seat.
718,widespread,adj.,The disease caused widespread panic in the community.
719,wisdom,n.,The old man shared his wisdom with the younger generation.
720,withdraw,v.,She decided to withdraw from the competition due to an injury.
721,workforce,n.,The company has a diverse and skilled workforce.
722,workplace,n.,She maintains a positive attitude in the workplace.
723,workshop,n.,The workshop focused on improving communication skills.
724,worm,n.,The farmer found a worm in the freshly dug soil.
725,wrist,n.,She wore a gold watch on her wrist.