SID,WORD,POS,Context
1,absorb,v.,"The sponge can absorb a lot of water, making it useful for cleaning spills."
2,abstract,n.,The museum featured an abstract painting that confused many viewers.
3,abstract,adj.,His abstract painting leaves the interpretation up to the viewer's imagination.
4,accent,n.,Her French accent made her English sound charming and sophisticated.
5,accidentally,adv.,"I accidentally dropped the glass, and it shattered on the floor."
6,accommodate,v.,The hotel can accommodate over 200 guests in its spacious rooms.
7,accomplish,v.,He set out to accomplish his task before noon and succeeded.
8,accountant,n.,The company hired an accountant to manage their financial statements.
9,accuracy,n.,The accuracy of her report was crucial for the board meeting.
10,accurately,adv.,He measured the dimensions accurately to ensure the piece would fit.
11,acid,n.,Lemon juice is known for its high acid content.
12,activate,v.,She needs to activate her account before she can start using the app.
13,addiction,n.,Nicotine addiction is a serious problem for many smokers.
14,additionally,adv.,"Additionally, the package includes free access to the gym."
15,adequate,adj.,The space in the backseat is adequate for two passengers.
16,adequately,adv.,The tutorial explains the process adequately for beginners.
17,adjust,v.,You can adjust the volume of the music with this knob.
18,affordable,adj.,They were looking for a more affordable option to reduce costs.
19,agriculture,n.,"Agriculture is a key sector in the country's economy, focusing on corn and wheat production."
20,AIDS,n.,AIDS is a life-threatening condition caused by the HIV virus.
21,alien,n.,"In the movie, the alien comes from a distant galaxy."
22,alongside,prep.,He worked alongside his colleagues to complete the project on time.
23,altogether,adv.,"Altogether, there were fifty participants at the seminar."
24,ambulance,n.,An ambulance rushed to the scene of the accident.
25,amusing,adj.,The comedian's routine was amusing and kept everyone laughing.
26,analyst,n.,The data analyst presented the latest findings on market trends.
27,ancestor,n.,Our ancestors migrated from Europe over a century ago.
28,animation,n.,The children enjoyed the vibrant colors and fun stories in the animation.
29,annually,adv.,The conference takes place annually in July.
30,anticipate,v.,We anticipate a large crowd for the concert next week.
31,anxiety,n.,She felt a wave of anxiety before her presentation.
32,apology,n.,He made a sincere apology for his mistake.
33,applicant,n.,The applicant impressed the interviewers with her knowledge and enthusiasm.
34,appropriately,adv.,Dress appropriately for the formal dinner.
35,arrow,n.,The archer aimed the arrow at the target.
36,artwork,n.,The gallery features artwork from contemporary artists.
37,aside,adv.,Let's put our differences aside and work together.
38,asset,n.,The company considers its skilled workforce its most valuable asset.
39,assign,v.,The teacher will assign homework over the weekend.
40,assistance,n.,She offered her assistance when she saw that I was overwhelmed.
41,assumption,n.,His decision was based on the assumption that the market would improve.
42,assure,v.,I can assure you that the vehicle is in excellent condition.
43,astonishing,adj.,The magician's astonishing trick left the audience in awe.
44,attachment,n.,She has a strong attachment to her childhood toys.
45,auction,n.,The antique vase was sold at the auction for a high price.
46,audio,adj.,The audio equipment needs to be set up before the conference.
47,automatic,adj.,The car features an automatic transmission.
48,automatically,adv.,The doors open automatically when you approach.
49,awareness,n.,There is growing awareness about mental health issues.
50,awkward,adj.,"His attempt at humor was awkward, causing an uncomfortable silence."
51,badge,n.,Every participant received a badge with their name on it.
52,balanced,adj.,She aims for a balanced diet to improve her health.
53,ballet,n.,The ballet performance was breathtakingly beautiful.
54,balloon,n.,"The child let go of the string, and the balloon floated away into the sky."
55,barely,adv.,He barely made it to the bus on time.
56,bargain,n.,"She found a bargain at the store, a shirt for half price."
57,basement,n.,They converted their basement into a game room.
58,basket,n.,She carried a basket filled with fresh fruit from the market.
59,bat,n.,"During the game, he swung the bat hard and hit a home run."
60,beneficial,adj.,Drinking water frequently is beneficial for your health.
61,beside,prep.,She sat beside her friend at the movie theater.
62,besides,prep.,"Besides mathematics, he is also excellent in science."
63,besides,adv.,"He is not ready to buy a car; besides, he prefers biking."
64,bias,n.,The article showed a clear bias towards one side of the argument.
65,bid,n.,"His bid at the auction was the highest, winning him the antique vase."
66,bid,v.,She will bid for the painting she loves at the next auction.
67,biological,adj.,Biological research can provide answers to many medical questions.
68,blanket,n.,She wrapped herself in a warm blanket on the cold night.
69,blow,n.,The blow to his pride was worse than his physical injuries.
70,bold,adj.,Her bold approach to business is both admired and criticized.
71,bombing,n.,The news reported a tragic bombing in the city.
72,booking,n.,I made a booking at our favorite restaurant for Friday night.
73,boost,v.,The good review helped to boost sales of his new book.
74,boost,n.,The endorsement was a major boost to her campaign.
75,bound,adj.,They were bound for New York but ended up in Boston due to a mistake.
76,brick,n.,The house was built with red bricks.
77,briefly,adv.,She spoke briefly to the audience before exiting the stage.
78,broadcaster,n.,The broadcaster announced the news of the royal wedding.
79,broadly,adv.,He smiled broadly when he heard the good news.
80,bug,n.,A small bug crawled across the leaf.
81,cabin,n.,The log cabin by the lake is a perfect getaway spot.
82,canal,n.,They took a boat ride through the ancient canal.
83,candle,n.,The room was lit by a single candle.
84,carbon,n.,Plants absorb carbon dioxide and release oxygen.
85,casual,adj.,"The invitation called for casual attire, so jeans and a t-shirt were fine."
86,cave,n.,The explorers discovered ancient paintings inside the cave.
87,certainty,n.,"With absolute certainty, she knew she had made the right choice."
88,certificate,n.,"Upon completing the course, he received a certificate."
89,challenging,adj.,The puzzle was challenging but fun to solve.
90,championship,n.,The team won the national championship after a dramatic final match.
91,charming,adj.,His charming manner won him many friends.
92,chase,v.,The police chase ended when the suspect's car crashed.
93,chase,n.,The chase through the crowded streets was thrilling to watch.
94,cheek,n.,She kissed her grandmother on the cheek.
95,cheer,v.,The crowd began to cheer loudly as the players took the field.
96,cheer,n.,There was a great cheer from the audience at the end of the performance.
97,choir,n.,The choir sang beautifully at the concert last night.
98,chop,v.,He used an axe to chop the wood for the fireplace.
99,circuit,n.,The electric circuit is designed to cut off power in an emergency.
100,civilization,n.,The ruins of the ancient civilization were discovered buried beneath the forest.
101,clarify,v.,Could you clarify your statement? I'm not sure I understand what you mean.
102,classify,v.,Biologists classify organisms into groups to make them easier to study.
103,clerk,n.,The clerk at the front desk will help you with check-in.
104,cliff,n.,"The cliff overlooks a vast, beautiful ocean."
105,clinic,n.,She visited the clinic for her routine health check-up.
106,clip,n.,He used a clip to keep the papers together.
107,coincidence,n.,Running into her in France was a pure coincidence since they both lived in Canada.
108,collector,n.,He is a well-known collector of rare books.
109,colony,n.,The penguin colony was protected by environmental laws.
110,colourful,adj.,The festival was vibrant with colourful banners and costumes.
111,comic,adj.,His comic timing always left the room in laughter.
112,comic,n.,She bought a comic book at the store to read on her flight.
113,commander,n.,The commander issued orders to her troops.
114,comparative,adj.,They conducted a comparative study between two different teaching methods.
115,completion,n.,The completion of the project was delayed by unforeseen circumstances.
116,compose,v.,He will compose a new symphony for the orchestra.
117,composer,n.,The composer was known for his complex and beautiful piano concertos.
118,compound,n.,The scientist mixed a compound that changed color when heated.
119,comprehensive,adj.,The final exam will cover a comprehensive list of topics.
120,comprise,v.,The committee is comprised of members from various departments.
121,compulsory,adj.,Attendance is compulsory at the seminar.
122,concrete,adj.,His plans for the startup were concrete and well-thought-out.
123,concrete,n.,The workers poured concrete to lay the foundation.
124,confess,v.,He decided to confess his mistakes to his friend.
125,confusion,n.,The sudden announcement caused confusion among the employees.
126,consequently,adv.,She missed her train and consequently was late to the meeting.
127,conservation,n.,Wildlife conservation is essential for maintaining biodiversity.
128,considerable,adj.,The project received considerable support from the community.
129,considerably,adv.,The costs have increased considerably since last year.
130,consistently,adv.,He has been performing consistently well this season.
131,conspiracy,n.,The documentary explores the conspiracy theories surrounding the event.
132,consult,v.,It's best to consult a lawyer before signing any legal documents.
133,consultant,n.,She worked as a financial consultant before starting her own business.
134,consumption,n.,The consumption of electricity spikes during the cold winter months.
135,controversial,adj.,The new law is controversial and has sparked a lot of debates.
136,controversy,n.,The novel sparked controversy because of its provocative themes.
137,convenience,n.,The shop's proximity to my home is a great convenience.
138,convention,n.,They attended the annual science fiction convention together.
139,conventional,adj.,His views on education are quite conventional.
140,convey,v.,The artist conveys a strong message through her sculptures.
141,convincing,adj.,Her argument was convincing enough to change his mind.
142,cope,v.,We need to learn how to cope with stress effectively.
143,corporation,n.,She works for a multinational corporation.
144,corridor,n.,The long corridor led to a series of locked doors.
145,counter,n.,He placed his keys on the kitchen counter.
146,coverage,n.,The news provided extensive coverage of the election.
147,crack,v.,The window crack...
148,crack,n.,"The vase has a small crack on its side, but it's still beautiful."
149,craft,n.,Her craft in pottery has earned her numerous awards.
150,creativity,n.,Innovation requires creativity and a willingness to take risks.
151,critically,adv.,The patient is critically ill and needs immediate care.
152,cruise,n.,The family went on a cruise to the Caribbean.
153,cruise,v.,We could just cruise along the coast in the convertible.
154,cue,n.,The actor missed his cue and entered the stage too late.
155,curious,adj.,The curious child asked countless questions during the museum tour.
156,curriculum,n.,The new curriculum focuses more on practical skills.
157,cute,adj.,The puppy's cute antics made everyone smile.
158,dairy,n.,The dairy farm supplies milk to the entire region.
159,dairy,adj.,Dairy products like cheese and butter can be found in the refrigerated section.
160,dare,v.,I dare you to try the hottest sauce on the menu.
161,darkness,n.,"As the sun set, the room was enveloped in darkness."
162,database,n.,The company maintains a large database of client information.
163,deadline,n.,The project's deadline was pushed back a week.
164,deadly,adj.,The venom of the snake is highly deadly.
165,dealer,n.,The dealer in rare coins offered him a good price.
166,deck,n.,We enjoyed the evening on the boat's deck.
167,defender,n.,The defender blocked the opposing team's shot at the goal.
168,delete,v.,She decided to delete the old files to free up space.
169,democracy,n.,Living in a democracy allows citizens to vote on important issues.
170,democratic,adj.,The democratic process is vital for a fair society.
171,demonstration,n.,The demonstration downtown drew a large crowd.
172,depart,v.,The train will depart from platform 9 at noon.
173,dependent,adj.,Children are financially dependent on their parents.
174,deposit,n.,He made a large deposit into his savings account.
175,depression,n.,"After the 1929 stock market crash, the Great Depression began."
176,derive,v.,Many English words derive from Latin.
177,desperately,adv.,He desperately needed the job to pay his bills.
178,destruction,n.,The destruction after the hurricane was unimaginable.
179,determination,n.,Her determination helped her overcome numerous obstacles.
180,devote,v.,He decided to devote more time to his hobbies.
181,differ,v.,The opinions of the experts differ on this issue.
182,disability,n.,The facilities were designed to accommodate people with disabilities.
183,disabled,adj.,Disabled parking is available near the entrance.
184,disagreement,n.,There was a disagreement about how to proceed.
185,disappoint,v.,I hope the finale doesn't disappoint.
186,disappointment,n.,His rejection was a big disappointment.
187,discourage,v.,Don't let failure discourage you from trying again.
188,disorder,n.,He was diagnosed with a rare genetic disorder.
189,distant,adj.,The stars are distant and mysterious.
190,distinct,adj.,His style is distinct from anyone else's in the industry.
191,distinguish,v.,It's important to distinguish fact from opinion.
192,distract,v.,The noise could distract the students during the exam.
193,disturb,v.,Please do not disturb her while she's working.
194,dive,v.,The diver prepared to dive into the deep blue sea.
195,diverse,adj.,The university is known for its diverse student body.
196,diversity,n.,We need to celebrate the diversity in our community.
197,divorce,v.,"After many attempts to reconcile, they decided to divorce."
198,dominant,adj.,"In the animal kingdom, the dominant male often leads the group."
199,donation,n.,The charity appreciated every donation it received.
200,dot,n.,Please place a dot at the end of each item in the list.
201,downtown,n.,We walked through downtown to enjoy the lively atmosphere.
202,dramatically,adv.,The situation improved dramatically after the new policy was implemented.
203,drought,n.,The region has been suffering from a severe drought for years.
204,dull,adj.,The lecture was so dull that several students fell asleep.
205,dump,v.,The city plans to dump the waste in a new landfill site.
206,duration,n.,The duration of the film is two hours.
207,dynamic,adj.,The meeting was dynamic and full of energetic discussions.
208,economics,n.,She decided to study economics to understand global markets better.
209,economist,n.,The economist presented a bleak forecast for the economy.
210,editorial,adj.,The editorial team worked late to meet the deadline.
211,efficiently,adv.,The factory now operates more efficiently thanks to the new equipment.
212,elbow,n.,He leaned on his elbow while reading the book.
213,electronics,n.,"The store offers a wide range of electronics, from TVs to smartphones."
214,elegant,adj.,She wore an elegant dress to the gala last night.
215,elementary,adj.,The elementary principles of chemistry are crucial for advanced study.
216,eliminate,v.,The new policy aims to eliminate waste in the department.
217,embrace,v.,They embrace every opportunity to learn something new.
218,emission,n.,The factory's emission levels need to be checked regularly.
219,emotionally,adv.,She was emotionally drained after the long meeting.
220,empire,n.,The Roman Empire was known for its vast reach and powerful rulers.
221,enjoyable,adj.,The trip was enjoyable thanks to the good company.
222,entertaining,adj.,The movie was surprisingly entertaining and witty.
223,entrepreneur,n.,The young entrepreneur launched her first startup at the age of 22.
224,envelope,n.,He sealed the letter in an envelope and mailed it.
225,equip,v.,The workshop is equipped with the latest technological tools.
226,equivalent,adj.,Their qualifications are equivalent to a bachelor's degree.
227,era,n.,The Victorian era is noted for its significant cultural changes.
228,erupt,v.,"The volcano could erupt at any moment, according to experts."
229,essentially,adv.,"Essentially, the two concepts are similar but not identical."
230,ethic,n.,The company prides itself on its strong work ethic.
231,ethnic,adj.,The festival celebrates ethnic diversity with various cultural performances.
232,evaluation,n.,The evaluation of the project showed positive results.
233,evident,adj.,The impact of the policy was evident from the improved results.
234,evolution,n.,The evolution of technology has transformed how we communicate.
235,evolve,v.,His ideas need to evolve to stay relevant in the changing market.
236,exceed,v.,Sales this quarter exceed expectations by a significant margin.
237,exception,n.,Everyone must follow the rules without exception.
238,excessive,adj.,Excessive speed is a major cause of road accidents.
239,exclude,v.,The offer does not exclude anyone based on their background.
240,exhibit,v.,The museum will exhibit ancient artifacts next month.
241,exit,n.,The exit is on the left side of the building.
242,exotic,adj.,They enjoyed exotic fruits during their tropical vacation.
243,expansion,n.,The expansion of the city has brought new business opportunities.
244,expertise,n.,His expertise in robotics is well recognized in the industry.
245,exploit,v.,It's unethical to exploit workers for profit.
246,exposure,n.,Exposure to different cultures can broaden one's perspective.
247,extension,n.,They applied for an extension of the project deadline.
248,extensive,adj.,The research required extensive fieldwork and data analysis.
249,extensively,adv.,The novel has been extensively reviewed in literary circles.
250,extract,n.,The extract from the plant is used in natural remedies.
251,fabric,n.,The dress is made from a delicate and expensive fabric.
252,fabulous,adj.,They had a fabulous time at the wedding.
253,failed,adj.,His attempt was marked as a failed experiment in the records.
254,fake,adj.,The museum discovered that the painting was a fake.
255,fame,n.,Her sudden rise to fame overwhelmed her initially.
256,fantasy,n.,His latest book is a fantasy set in an imaginary world.
257,fare,n.,The fare for the bus has increased since last year.
258,federal,adj.,The federal government announced new educational reforms.
259,fever,n.,"If the fever persists, you should consult a doctor."
260,firefighter,n.,The firefighter received an award for bravery.
261,firework,n.,The fireworks display was the highlight of the festival.
262,firm,adj.,She has a firm belief in the importance of education.
263,firmly,adv.,He firmly stated his opposition to the proposal.
264,flavour,n.,The chef added spices to enhance the dish's flavour.
265,fond,adj.,She is fond of her hometown and visits often.
266,fool,n.,He felt like a fool after making such a simple mistake.
267,forbid,v.,The law forbids the use of mobile phones while driving.
268,forecast,v.,Analysts forecast a rise in prices next quarter.
269,format,n.,The report should be submitted in PDF format.
270,formation,n.,The formation of ice on the wings is a risk during the flight.
271,formerly,adv.,The building was formerly used as a school.
272,fortunate,adj.,They were fortunate to escape the fire unharmed.
273,forum,n.,The forum will discuss the effects of global warming.
274,fossil,n.,Fossil evidence can tell us a lot about ancient life forms.
275,foundation,n.,The charity foundation supports educational projects.
276,founder,n.,The founder of the company still plays an active role in its management.
277,fraction,n.,Only a small fraction of the budget was spent on marketing.
278,fragment,n.,Archaeologists found fragments of pottery at the site.
279,framework,n.,The legal framework needs to be established before the project can proceed.
280,fraud,n.,The accountant was found guilty of committing fraud.
281,freely,adv.,She spoke freely about her experiences at the conference.
282,frequent,adj.,His frequent absences were noted by his employer.
283,fulfil,v.,They strive to fulfil all their commitments on time.
284,full-time,adj.,She works full-time at the law firm.
285,fundamentally,adv.,The two theories are fundamentally different.
286,furious,adj.,She was furious when she found out the truth.
287,gaming,n.,He works in the gaming industry designing video games.
288,gay,adj.,The city held its annual gay pride parade.
289,gender,n.,"The survey collected data on age, gender, and occupation."
290,gene,n.,Scientists have identified the gene responsible for the disease.
291,genetic,adj.,Genetic factors play a role in determining height.
292,genius,n.,His work in physics proves he is a genius.
293,genuine,adj.,They expressed genuine concern for her well-being.
294,genuinely,adv.,She was genuinely surprised by the party her friends organized.
295,gesture,n.,His kind gesture made her day.
296,gig,n.,He landed a gig playing guitar at the local jazz club.
297,globalization,n.,Globalization has led to increased economic interdependence.
298,globe,n.,The teacher used a globe to explain the geography lesson.
299,golden,adj.,The golden statue was the centerpiece of the exhibition.
300,goodness,n.,She helped out of the goodness of her heart.
301,gorgeous,adj.,The view from the top of the mountain is gorgeous.
302,governor,n.,The governor will be attending the ceremony in the city hall.
303,graphic,adj.,The graphic details of the report were disturbing.
304,graphics,n.,The video game has impressive graphics.
305,greatly,adv.,His health has improved greatly since the operation.
306,greenhouse,n.,They grow tomatoes in a greenhouse to extend the growing season.
307,grocery,n.,We need to stop by the grocery store to pick up some dinner supplies.
308,guideline,n.,The company guidelines ensure fair treatment of all employees.
309,habitat,n.,Conservation efforts aim to protect the natural habitat of endangered species.
310,harbour,n.,The old harbour is a popular spot for tourists to visit.
311,headquarters,n.,The company's headquarters are located in New York.
312,heal,v.,It took months for her injury to fully heal.
313,healthcare,n.,Everyone should have access to affordable healthcare.
314,helmet,n.,It's important to wear a helmet when riding a bicycle.
315,hence,adv.,"Hence, we need to reconsider our strategy to improve results."
316,herb,n.,"He grows several herbs in his garden, including basil and thyme."
317,hidden,adj.,She discovered a hidden talent for painting during the class.
318,highway,n.,The accident caused a major traffic jam on the highway.
319,hilarious,adj.,The movie was hilarious; we couldn't stop laughing.
320,hip,n.,She injured her hip during the fall.
321,historian,n.,The historian wrote a book on the medieval period.
322,homeless,adj.,The shelter provides assistance to homeless individuals.
323,honesty,n.,Honesty is the best policy in all relationships.
324,hook,n.,He hung his coat on the hook by the door.
325,hopefully,adv.,"Hopefully, the weather will be good for our picnic."
326,hunger,n.,Many organizations are working to reduce hunger worldwide.
327,hypothesis,n.,The scientist tested her hypothesis through experiments.
328,icon,n.,The software uses an icon to represent the editing function.
329,identical,adj.,The twins are not identical; they have different features.
330,illusion,n.,The magician's trick created the illusion of a disappearing car.
331,immigration,n.,Immigration policies vary significantly from one country to another.
332,immune,adj.,He is immune to chickenpox because he had it as a child.
333,implement,v.,They plan to implement the new system next month.
334,implication,n.,The implications of the research are profound.
335,incentive,n.,The company offers incentives for employees to perform well.
336,incorporate,v.,They decided to incorporate sustainable practices into their business model.
337,incorrect,adj.,The answer he gave was incorrect.
338,independence,n.,Many countries celebrate their independence with national holidays.
339,index,n.,The book includes an index at the back for easy reference.
340,indication,n.,There was no indication of trouble before the accident happened.
341,inevitable,adj.,It was inevitable that the secret would eventually come out.
342,inevitably,adv.,"Inevitably, the rain started just as the parade began."
343,infer,v.,"From the evidence, we can infer that the suspect was present at the scene."
344,inflation,n.,Inflation has caused the price of groceries to rise.
345,info,n.,"For more info, please visit our website."
346,infrastructure,n.,The government is investing in infrastructure projects like roads and bridges.
347,inhabitant,n.,The inhabitants of the island are known for their hospitality.
348,inherit,v.,She will inherit the house from her grandparents.
349,ink,n.,He refilled the printer with black ink.
350,innovation,n.,The company is known for its innovation in developing new products.
351,innovative,adj.,Their innovative approach to marketing has won several awards.
